[
  {
    "schema_version": "1.0.0",
    "tenant_id": "lumera-fixture",
    "run_id": "DCS-RUN-001",
    "check_id": "FD-01",
    "status": "PASS",
    "score_factor": 1,
    "numeric_weight": 0,
    "confidence": "HIGH",
    "confidence_factor": 1,
    "reason_code": null,
    "evidence": [
      {
        "source": "fixture",
        "locator": "lumera/FD-01",
        "value": "synthetic-evidence",
        "observed_at": "2026-07-18T10:00:00Z"
      }
    ],
    "scoring_model_version": "DCS-1.0.0",
    "evaluated_at": "2026-07-18T10:05:00Z",
    "provenance": {
      "source_versions": {
        "fixture": "1.0.0"
      },
      "created_at": "2026-07-18T10:05:00Z",
      "created_by": "Klints fixture generator"
    }
  },
  {
    "schema_version": "1.0.0",
    "tenant_id": "lumera-fixture",
    "run_id": "DCS-RUN-001",
    "check_id": "FD-02",
    "status": "PASS",
    "score_factor": 1,
    "numeric_weight": 0,
    "confidence": "HIGH",
    "confidence_factor": 1,
    "reason_code": null,
    "evidence": [
      {
        "source": "fixture",
        "locator": "lumera/FD-02",
        "value": "synthetic-evidence",
        "observed_at": "2026-07-18T10:00:00Z"
      }
    ],
    "scoring_model_version": "DCS-1.0.0",
    "evaluated_at": "2026-07-18T10:05:00Z",
    "provenance": {
      "source_versions": {
        "fixture": "1.0.0"
      },
      "created_at": "2026-07-18T10:05:00Z",
      "created_by": "Klints fixture generator"
    }
  },
  {
    "schema_version": "1.0.0",
    "tenant_id": "lumera-fixture",
    "run_id": "DCS-RUN-001",
    "check_id": "FD-03",
    "status": "PASS",
    "score_factor": 1,
    "numeric_weight": 0,
    "confidence": "HIGH",
    "confidence_factor": 1,
    "reason_code": null,
    "evidence": [
      {
        "source": "fixture",
        "locator": "lumera/FD-03",
        "value": "synthetic-evidence",
        "observed_at": "2026-07-18T10:00:00Z"
      }
    ],
    "scoring_model_version": "DCS-1.0.0",
    "evaluated_at": "2026-07-18T10:05:00Z",
    "provenance": {
      "source_versions": {
        "fixture": "1.0.0"
      },
      "created_at": "2026-07-18T10:05:00Z",
      "created_by": "Klints fixture generator"
    }
  },
  {
    "schema_version": "1.0.0",
    "tenant_id": "lumera-fixture",
    "run_id": "DCS-RUN-001",
    "check_id": "FD-04",
    "status": "PASS",
    "score_factor": 1,
    "numeric_weight": 0,
    "confidence": "HIGH",
    "confidence_factor": 1,
    "reason_code": null,
    "evidence": [
      {
        "source": "fixture",
        "locator": "lumera/FD-04",
        "value": "synthetic-evidence",
        "observed_at": "2026-07-18T10:00:00Z"
      }
    ],
    "scoring_model_version": "DCS-1.0.0",
    "evaluated_at": "2026-07-18T10:05:00Z",
    "provenance": {
      "source_versions": {
        "fixture": "1.0.0"
      },
      "created_at": "2026-07-18T10:05:00Z",
      "created_by": "Klints fixture generator"
    }
  },
  {
    "schema_version": "1.0.0",
    "tenant_id": "lumera-fixture",
    "run_id": "DCS-RUN-001",
    "check_id": "FD-05",
    "status": "PASS",
    "score_factor": 1,
    "numeric_weight": 0,
    "confidence": "HIGH",
    "confidence_factor": 1,
    "reason_code": null,
    "evidence": [
      {
        "source": "fixture",
        "locator": "lumera/FD-05",
        "value": "synthetic-evidence",
        "observed_at": "2026-07-18T10:00:00Z"
      }
    ],
    "scoring_model_version": "DCS-1.0.0",
    "evaluated_at": "2026-07-18T10:05:00Z",
    "provenance": {
      "source_versions": {
        "fixture": "1.0.0"
      },
      "created_at": "2026-07-18T10:05:00Z",
      "created_by": "Klints fixture generator"
    }
  },
  {
    "schema_version": "1.0.0",
    "tenant_id": "lumera-fixture",
    "run_id": "DCS-RUN-001",
    "check_id": "FD-06",
    "status": "PASS",
    "score_factor": 1,
    "numeric_weight": 0,
    "confidence": "HIGH",
    "confidence_factor": 1,
    "reason_code": null,
    "evidence": [
      {
        "source": "fixture",
        "locator": "lumera/FD-06",
        "value": "synthetic-evidence",
        "observed_at": "2026-07-18T10:00:00Z"
      }
    ],
    "scoring_model_version": "DCS-1.0.0",
    "evaluated_at": "2026-07-18T10:05:00Z",
    "provenance": {
      "source_versions": {
        "fixture": "1.0.0"
      },
      "created_at": "2026-07-18T10:05:00Z",
      "created_by": "Klints fixture generator"
    }
  },
  {
    "schema_version": "1.0.0",
    "tenant_id": "lumera-fixture",
    "run_id": "DCS-RUN-001",
    "check_id": "FD-07",
    "status": "PASS",
    "score_factor": 1,
    "numeric_weight": 0,
    "confidence": "HIGH",
    "confidence_factor": 1,
    "reason_code": null,
    "evidence": [
      {
        "source": "fixture",
        "locator": "lumera/FD-07",
        "value": "synthetic-evidence",
        "observed_at": "2026-07-18T10:00:00Z"
      }
    ],
    "scoring_model_version": "DCS-1.0.0",
    "evaluated_at": "2026-07-18T10:05:00Z",
    "provenance": {
      "source_versions": {
        "fixture": "1.0.0"
      },
      "created_at": "2026-07-18T10:05:00Z",
      "created_by": "Klints fixture generator"
    }
  },
  {
    "schema_version": "1.0.0",
    "tenant_id": "lumera-fixture",
    "run_id": "DCS-RUN-001",
    "check_id": "CI-01",
    "status": "PASS",
    "score_factor": 1,
    "numeric_weight": 4,
    "confidence": "HIGH",
    "confidence_factor": 1,
    "reason_code": null,
    "evidence": [
      {
        "source": "fixture",
        "locator": "lumera/CI-01",
        "value": "synthetic-evidence",
        "observed_at": "2026-07-18T10:00:00Z"
      }
    ],
    "scoring_model_version": "DCS-1.0.0",
    "evaluated_at": "2026-07-18T10:05:00Z",
    "provenance": {
      "source_versions": {
        "fixture": "1.0.0"
      },
      "created_at": "2026-07-18T10:05:00Z",
      "created_by": "Klints fixture generator"
    }
  },
  {
    "schema_version": "1.0.0",
    "tenant_id": "lumera-fixture",
    "run_id": "DCS-RUN-001",
    "check_id": "CI-02",
    "status": "PASS",
    "score_factor": 1,
    "numeric_weight": 4,
    "confidence": "HIGH",
    "confidence_factor": 1,
    "reason_code": null,
    "evidence": [
      {
        "source": "fixture",
        "locator": "lumera/CI-02",
        "value": "synthetic-evidence",
        "observed_at": "2026-07-18T10:00:00Z"
      }
    ],
    "scoring_model_version": "DCS-1.0.0",
    "evaluated_at": "2026-07-18T10:05:00Z",
    "provenance": {
      "source_versions": {
        "fixture": "1.0.0"
      },
      "created_at": "2026-07-18T10:05:00Z",
      "created_by": "Klints fixture generator"
    }
  },
  {
    "schema_version": "1.0.0",
    "tenant_id": "lumera-fixture",
    "run_id": "DCS-RUN-001",
    "check_id": "CI-03",
    "status": "FAIL",
    "score_factor": 0,
    "numeric_weight": 4,
    "confidence": "HIGH",
    "confidence_factor": 1,
    "reason_code": null,
    "evidence": [
      {
        "source": "fixture",
        "locator": "lumera/CI-03",
        "value": "synthetic-evidence",
        "observed_at": "2026-07-18T10:00:00Z"
      }
    ],
    "scoring_model_version": "DCS-1.0.0",
    "evaluated_at": "2026-07-18T10:05:00Z",
    "provenance": {
      "source_versions": {
        "fixture": "1.0.0"
      },
      "created_at": "2026-07-18T10:05:00Z",
      "created_by": "Klints fixture generator"
    }
  },
  {
    "schema_version": "1.0.0",
    "tenant_id": "lumera-fixture",
    "run_id": "DCS-RUN-001",
    "check_id": "CI-05",
    "status": "PASS",
    "score_factor": 1,
    "numeric_weight": 4,
    "confidence": "HIGH",
    "confidence_factor": 1,
    "reason_code": null,
    "evidence": [
      {
        "source": "fixture",
        "locator": "lumera/CI-05",
        "value": "synthetic-evidence",
        "observed_at": "2026-07-18T10:00:00Z"
      }
    ],
    "scoring_model_version": "DCS-1.0.0",
    "evaluated_at": "2026-07-18T10:05:00Z",
    "provenance": {
      "source_versions": {
        "fixture": "1.0.0"
      },
      "created_at": "2026-07-18T10:05:00Z",
      "created_by": "Klints fixture generator"
    }
  },
  {
    "schema_version": "1.0.0",
    "tenant_id": "lumera-fixture",
    "run_id": "DCS-RUN-001",
    "check_id": "LE-01",
    "status": "PASS",
    "score_factor": 1,
    "numeric_weight": 4,
    "confidence": "HIGH",
    "confidence_factor": 1,
    "reason_code": null,
    "evidence": [
      {
        "source": "fixture",
        "locator": "lumera/LE-01",
        "value": "synthetic-evidence",
        "observed_at": "2026-07-18T10:00:00Z"
      }
    ],
    "scoring_model_version": "DCS-1.0.0",
    "evaluated_at": "2026-07-18T10:05:00Z",
    "provenance": {
      "source_versions": {
        "fixture": "1.0.0"
      },
      "created_at": "2026-07-18T10:05:00Z",
      "created_by": "Klints fixture generator"
    }
  },
  {
    "schema_version": "1.0.0",
    "tenant_id": "lumera-fixture",
    "run_id": "DCS-RUN-001",
    "check_id": "LE-02",
    "status": "PASS",
    "score_factor": 1,
    "numeric_weight": 4,
    "confidence": "HIGH",
    "confidence_factor": 1,
    "reason_code": null,
    "evidence": [
      {
        "source": "fixture",
        "locator": "lumera/LE-02",
        "value": "synthetic-evidence",
        "observed_at": "2026-07-18T10:00:00Z"
      }
    ],
    "scoring_model_version": "DCS-1.0.0",
    "evaluated_at": "2026-07-18T10:05:00Z",
    "provenance": {
      "source_versions": {
        "fixture": "1.0.0"
      },
      "created_at": "2026-07-18T10:05:00Z",
      "created_by": "Klints fixture generator"
    }
  },
  {
    "schema_version": "1.0.0",
    "tenant_id": "lumera-fixture",
    "run_id": "DCS-RUN-001",
    "check_id": "LE-03",
    "status": "PASS",
    "score_factor": 1,
    "numeric_weight": 4,
    "confidence": "HIGH",
    "confidence_factor": 1,
    "reason_code": null,
    "evidence": [
      {
        "source": "fixture",
        "locator": "lumera/LE-03",
        "value": "synthetic-evidence",
        "observed_at": "2026-07-18T10:00:00Z"
      }